{
  "$schema": "http://json-schema.org/draft-04/schema#",
  "id": "http://moj.gov.uk/cps/prosecutioncasefile/command/api/plead-online.json",
  "type": "object",
  "properties": {
    "caseId": {
      "$ref": "http://cpp.moj.gov.uk/prosecution/casefile/plea/json/schemas/definitions.json#/definitions/uuid"
    },
    "urn": {
      "type": "string"
    },
    "defendantId": {
      "$ref": "http://cpp.moj.gov.uk/prosecution/casefile/plea/json/schemas/definitions.json#/definitions/uuid"
    },
    "initiationCode": {
      "$ref": "http://cpp.moj.gov.uk/prosecution/casefile/plea/json/schemas/initiation-code.json"
    },
    "personalDetails": {
      "id": "http://cpp.moj.gov.uk/prosecution/casefile/plea/json/schemas/personal-details.json",
      "type": "object",
      "properties": {
        "firstName": {
          "type": "string"
        },
        "lastName": {
          "type": "string"
        },
        "address": {
          "$ref": "http://cpp.moj.gov.uk/prosecution/casefile/plea/json/schemas/address.json"
        },
        "contactDetails": {
          "$ref": "http://cpp.moj.gov.uk/prosecution/casefile/plea/json/schemas/contact-details.json",
          "required": [
            "email"
          ]
        },
        "dateOfBirth": {
          "type": "string"
        },
        "nationalInsuranceNumber": {
          "type": "string"
        },
        "driverNumber": {
          "$ref": "http://cpp.moj.gov.uk/prosecution/casefile/plea/json/schemas/definitions.json#/definitions/dvlaDriverLicence"
        },
        "driverLicenceDetails": {
          "type": "string"
        }
      },
      "required": [
        "firstName",
        "lastName",
        "address",
        "contactDetails",
        "dateOfBirth"
      ],
      "additionalProperties": false
    },
    "legalEntityDefendant": {
      "id": "http://cpp.moj.gov.uk/prosecution/casefile/plea/json/schemas/legal-entity-defendant.json",
      "type": "object",
      "properties": {
        "name": {
          "type": "string"
        },
        "address": {
          "$ref": "http://cpp.moj.gov.uk/prosecution/casefile/plea/json/schemas/address.json"
        },
        "contactDetails": {
          "$ref": "http://cpp.moj.gov.uk/prosecution/casefile/plea/json/schemas/contact-details.json",
          "required": [
            "email"
          ]
        },
        "incorporationNumber": {
          "type": "string"
        },
        "position": {
          "id": "http://cpp.moj.gov.uk/prosecution/casefile/plea/json/schemas/position.json",
          "type": "string"
        }
      },
      "required": [
        "name",
        "address",
        "contactDetails"
      ],
      "additionalProperties": false
    },
    "offences": {
      "type": "array",
      "items": {
        "id": "http://cpp.moj.gov.uk/prosecution/casefile/plea/json/schemas/offence.json",
        "type": "object",
        "properties": {
          "id": {
            "type": "string"
          },
          "title": {
            "type": "string"
          },
          "plea": {
            "id": "http://cpp.moj.gov.uk/prosecution/casefile/plea/json/schemas/plea-type.json",
            "type": "string",
            "enum": [
              "NOT_GUILTY",
              "GUILTY"
            ]
          },
          "mitigation": {
            "type": "string"
          },
          "notGuiltyBecause": {
            "type": "string"
          }
        },
        "required": [
          "id",
          "plea"
        ],
        "additionalProperties": false
      }
    },
    "comeToCourt": {
      "type": "boolean"
    },
    "witnessDispute": {
      "type": "string"
    },
    "witnessDetails": {
      "type": "string"
    },
    "outstandingFines": {
      "type": "boolean"
    },
    "interpreterLanguage": {
      "type": "string"
    },
    "speakWelsh": {
      "type": "boolean"
    },
    "unavailability": {
      "type": "string"
    },
    "financialMeans": {
      "id": "http://cpp.moj.gov.uk/prosecution/casefile/plea/json/schemas/financial-means.json",
      "type": "object",
      "properties": {
        "defendantId": {
          "$ref": "http://cpp.moj.gov.uk/prosecution/casefile/plea/json/schemas/definitions.json#/definitions/uuid"
        },
        "income": {
          "id": "http://cpp.moj.gov.uk/prosecution/casefile/plea/json/schemas/income.json",
          "type": "object",
          "properties": {
            "amount": {
              "type": "number"
            },
            "frequency": {
              "id": "http://cpp.moj.gov.uk/prosecution/casefile/plea/json/schemas/frequency.json",
              "type": "string",
              "enum": [
                "WEEKLY",
                "FORTNIGHTLY",
                "MONTHLY",
                "YEARLY"
              ]
            }
          },
          "required": [
            "amount",
            "frequency"
          ],
          "additionalProperties": false
        },
        "benefits": {
          "id": "http://cpp.moj.gov.uk/prosecution/casefile/plea/json/schemas/benefits.json",
          "type": "object",
          "properties": {
            "claimed": {
              "type": "boolean"
            },
            "type": {
              "type": "string"
            },
            "deductPenaltyPreference": {
              "type": "boolean"
            }
          },
          "required": [
            "claimed"
          ],
          "additionalProperties": false
        },
        "employmentStatus": {
          "type": "string"
        }
      },
      "additionalProperties": false
    },
    "legalEntityFinancialMeans": {
      "id": "http://cpp.moj.gov.uk/prosecution/casefile/plea/json/schemas/legal-entity-financial-means.json",
      "type": "object",
      "properties": {
        "outstandingFines": {
          "type": "boolean"
        },
        "tradingMoreThan12Months": {
          "type": "boolean"
        },
        "numberOfEmployees": {
          "type": "integer"
        },
        "grossTurnover": {
          "type": "number"
        },
        "netTurnover": {
          "type": "number"
        }
      },
      "additionalProperties": false
    },
    "employer": {
      "id": "http://cpp.moj.gov.uk/prosecution/casefile/plea/json/schemas/employer.json",
      "type": "object",
      "properties": {
        "employeeReference": {
          "type": "string"
        },
        "name": {
          "type": "string"
        },
        "phone": {
          "type": "string"
        },
        "address": {
          "$ref": "http://cpp.moj.gov.uk/prosecution/casefile/plea/json/schemas/address.json"
        }
      },
      "required": [
        "name",
        "address"
      ],
      "additionalProperties": false
    },
    "outgoings": {
      "type": "array",
      "items": {
        "id": "http://cpp.moj.gov.uk/prosecution/casefile/plea/json/schemas/outgoing.json",
        "type": "object",
        "properties": {
          "description": {
            "type": "string"
          },
          "amount": {
            "type": "number"
          }
        },
        "additionalProperties": false
      }
    },
    "disabilityNeeds": {
      "$ref": "http://cpp.moj.gov.uk/prosecution/casefile/plea/json/schemas/disability-needs.json"
    },
    "pcqId": {
      "$ref": "http://cpp.moj.gov.uk/prosecution/casefile/plea/json/schemas/definitions.json#/definitions/uuid"
    }
  },
  "oneOf": [
    {
      "required": [
        "caseId",
        "defendantId",
        "personalDetails",
        "offences",
        "initiationCode"
      ]
    },
    {
      "required": [
        "caseId",
        "defendantId",
        "legalEntityDefendant",
        "offences",
        "initiationCode"
      ]
    }
  ],
  "additionalProperties": false
}
